{
  "document_type": "stress_matrix",
  "inputs": {
    "initial_nav": 100.0,
    "product": "examples/fixtures/leveraged_nasdaq_3x.json",
    "regimes": [
      "trend_up",
      "trend_down",
      "chop",
      "gap_down",
      "rebound",
      "volatility_cluster"
    ],
    "stop_loss_pct": 15.0,
    "take_profit_pct": 20.0
  },
  "not_investment_advice": "This stress matrix is for scenario planning and education only. It is not investment advice, a recommendation, or a suitability determination.",
  "product": {
    "annual_fee_pct": 0.95,
    "currency": "USD",
    "leverage": 3.0,
    "name": "Generic 3x Nasdaq Daily Reset ETP",
    "reset_frequency": "daily",
    "ticker": "NDAQ3X",
    "underlying": "Nasdaq-100 reference index"
  },
  "provenance": {
    "command": "stress-matrix",
    "initial_nav": 100.0,
    "product": "examples/fixtures/leveraged_nasdaq_3x.json",
    "regimes": [
      "trend_up",
      "trend_down",
      "chop",
      "gap_down",
      "rebound",
      "volatility_cluster"
    ],
    "stop_loss": 0.15,
    "take_profit": 0.2
  },
  "rows": [
    {
      "days": 12,
      "etp_return_pct": 20.0961,
      "name": "Trend Up",
      "path_decay_vs_simple_multiple": 0.994607,
      "regime": "trend_up",
      "return_pct": 20.0961,
      "stop_event_labels": [
        "day 12 take_profit at NAV 120.096051"
      ],
      "stop_events": 1,
      "underlying_return_pct": 6.3671,
      "warnings_count": 4,
      "worst_drawdown_pct": -0.6038
    },
    {
      "days": 12,
      "etp_return_pct": -19.8516,
      "name": "Trend Down",
      "path_decay_vs_simple_multiple": 1.136554,
      "regime": "trend_down",
      "return_pct": -19.8516,
      "stop_event_labels": [
        "day 8 stop_loss at NAV 84.483822"
      ],
      "stop_events": 1,
      "underlying_return_pct": -6.996,
      "warnings_count": 4,
      "worst_drawdown_pct": -19.8516
    },
    {
      "days": 12,
      "etp_return_pct": -0.3186,
      "name": "Chop",
      "path_decay_vs_simple_multiple": -1.429133,
      "regime": "chop",
      "return_pct": -0.3186,
      "stop_event_labels": [],
      "stop_events": 0,
      "underlying_return_pct": 0.3702,
      "warnings_count": 4,
      "worst_drawdown_pct": -6.5029
    },
    {
      "days": 8,
      "etp_return_pct": -48.8504,
      "name": "Gap Down",
      "path_decay_vs_simple_multiple": 5.694511,
      "regime": "gap_down",
      "return_pct": -48.8504,
      "stop_event_labels": [
        "day 1 stop_loss at NAV 74.49623"
      ],
      "stop_events": 1,
      "underlying_return_pct": -18.1816,
      "warnings_count": 4,
      "worst_drawdown_pct": -52.5497
    },
    {
      "days": 10,
      "etp_return_pct": 5.1886,
      "name": "Rebound",
      "path_decay_vs_simple_multiple": -1.385944,
      "regime": "rebound",
      "return_pct": 5.1886,
      "stop_event_labels": [],
      "stop_events": 0,
      "underlying_return_pct": 2.1915,
      "warnings_count": 4,
      "worst_drawdown_pct": -12.5903
    },
    {
      "days": 12,
      "etp_return_pct": -9.0937,
      "name": "Volatility Cluster",
      "path_decay_vs_simple_multiple": -3.205395,
      "regime": "volatility_cluster",
      "return_pct": -9.0937,
      "stop_event_labels": [
        "day 7 stop_loss at NAV 83.613785"
      ],
      "stop_events": 1,
      "underlying_return_pct": -1.9628,
      "warnings_count": 4,
      "worst_drawdown_pct": -16.3862
    }
  ],
  "schema_version": "0.9",
  "warnings": [
    "Daily reset leverage means multi-day returns can differ materially from the underlying return times leverage.",
    "Scenario output is not investment advice and does not predict future returns.",
    "Large daily moves can compound quickly and may create losses larger than a simple one-day estimate.",
    "Fee drag is approximated as a constant daily deduction from the leveraged daily return."
  ]
}
